{
  "version": 1,
  "examples": [
    {
      "id": "profile",
      "purpose": "Przykład struktury Profile; dane demonstracyjne",
      "path": "valid/profile.json",
      "schema": "../schemas/domain.schema.json#/$defs/Profile",
      "local": {
        "result": "valid"
      },
      "server": {
        "result": "not_executed",
        "stage": "E3",
        "expected_result": "Struktura poprawnego komunikatu HTTP; przetworzenie zależy od stanu konta i preconditions przyszłego testu."
      },
      "detection_layer": "schema_and_fixture_semantics"
    },
    {
      "id": "goal",
      "purpose": "Przykład struktury Goal; dane demonstracyjne",
      "path": "valid/goal.json",
      "schema": "../schemas/domain.schema.json#/$defs/Goal",
      "local": {
        "result": "valid"
      },
      "server": {
        "result": "not_executed",
        "stage": "E3",
        "expected_result": "Struktura poprawnego komunikatu HTTP; przetworzenie zależy od stanu konta i preconditions przyszłego testu."
      },
      "detection_layer": "schema_and_fixture_semantics"
    },
    {
      "id": "meal",
      "purpose": "Przykład struktury Meal; dane demonstracyjne",
      "path": "valid/meal.json",
      "schema": "../schemas/domain.schema.json#/$defs/Meal",
      "local": {
        "result": "valid"
      },
      "server": {
        "result": "not_executed",
        "stage": "E3",
        "expected_result": "Struktura poprawnego komunikatu HTTP; przetworzenie zależy od stanu konta i preconditions przyszłego testu."
      },
      "detection_layer": "schema_and_fixture_semantics"
    },
    {
      "id": "weight",
      "purpose": "Przykład struktury Weight; dane demonstracyjne",
      "path": "valid/weight.json",
      "schema": "../schemas/domain.schema.json#/$defs/Weight",
      "local": {
        "result": "valid"
      },
      "server": {
        "result": "not_executed",
        "stage": "E3",
        "expected_result": "Struktura poprawnego komunikatu HTTP; przetworzenie zależy od stanu konta i preconditions przyszłego testu."
      },
      "detection_layer": "schema_and_fixture_semantics"
    },
    {
      "id": "diary-day",
      "purpose": "Przykład struktury DiaryDay; dane demonstracyjne",
      "path": "valid/diary-day.json",
      "schema": "../schemas/domain.schema.json#/$defs/DiaryDay",
      "local": {
        "result": "valid"
      },
      "server": {
        "result": "not_executed",
        "stage": "E3",
        "expected_result": "Struktura poprawnego komunikatu HTTP; przetworzenie zależy od stanu konta i preconditions przyszłego testu."
      },
      "detection_layer": "schema_and_fixture_semantics"
    },
    {
      "id": "product-draft",
      "purpose": "Przykład struktury ProductDraft; dane demonstracyjne",
      "path": "valid/product-draft.json",
      "schema": "../schemas/domain.schema.json#/$defs/ProductDraft",
      "local": {
        "result": "valid"
      },
      "server": {
        "result": "not_executed",
        "stage": "E3",
        "expected_result": "Struktura poprawnego komunikatu HTTP; przetworzenie zależy od stanu konta i preconditions przyszłego testu."
      },
      "detection_layer": "schema_and_fixture_semantics"
    },
    {
      "id": "estimate-input",
      "purpose": "Przykład struktury EstimateInput; dane demonstracyjne",
      "path": "valid/estimate-input.json",
      "schema": "../schemas/domain.schema.json#/$defs/EstimateInput",
      "local": {
        "result": "valid"
      },
      "server": {
        "result": "not_executed",
        "stage": "E3",
        "expected_result": "Struktura poprawnego komunikatu HTTP; przetworzenie zależy od stanu konta i preconditions przyszłego testu."
      },
      "detection_layer": "schema_and_fixture_semantics"
    },
    {
      "id": "estimate",
      "purpose": "Przykład struktury Estimate; dane demonstracyjne",
      "path": "valid/estimate.json",
      "schema": "../schemas/domain.schema.json#/$defs/Estimate",
      "local": {
        "result": "valid"
      },
      "server": {
        "result": "not_executed",
        "stage": "E3",
        "expected_result": "Struktura poprawnego komunikatu HTTP; przetworzenie zależy od stanu konta i preconditions przyszłego testu."
      },
      "detection_layer": "schema_and_fixture_semantics"
    },
    {
      "id": "consent-input",
      "purpose": "Przykład struktury ConsentInput; dane demonstracyjne",
      "path": "valid/consent-input.json",
      "schema": "../schemas/domain.schema.json#/$defs/ConsentInput",
      "local": {
        "result": "valid"
      },
      "server": {
        "result": "not_executed",
        "stage": "E3",
        "expected_result": "Struktura poprawnego komunikatu HTTP; przetworzenie zależy od stanu konta i preconditions przyszłego testu."
      },
      "detection_layer": "schema_and_fixture_semantics"
    },
    {
      "id": "consent",
      "purpose": "Przykład struktury Consent; dane demonstracyjne",
      "path": "valid/consent.json",
      "schema": "../schemas/domain.schema.json#/$defs/Consent",
      "local": {
        "result": "valid"
      },
      "server": {
        "result": "not_executed",
        "stage": "E3",
        "expected_result": "Struktura poprawnego komunikatu HTTP; przetworzenie zależy od stanu konta i preconditions przyszłego testu."
      },
      "detection_layer": "schema_and_fixture_semantics"
    },
    {
      "id": "bootstrap",
      "purpose": "Przykład struktury Bootstrap; dane demonstracyjne",
      "path": "valid/bootstrap.json",
      "schema": "../schemas/domain.schema.json#/$defs/Bootstrap",
      "local": {
        "result": "valid"
      },
      "server": {
        "result": "not_executed",
        "stage": "E3",
        "expected_result": "Struktura poprawnego komunikatu HTTP; przetworzenie zależy od stanu konta i preconditions przyszłego testu."
      },
      "detection_layer": "schema_and_fixture_semantics"
    },
    {
      "id": "profile-read",
      "purpose": "Przykład struktury ProfileRead; dane demonstracyjne",
      "path": "valid/profile-read.json",
      "schema": "../schemas/domain.schema.json#/$defs/ProfileRead",
      "local": {
        "result": "valid"
      },
      "server": {
        "result": "not_executed",
        "stage": "E3",
        "expected_result": "Struktura poprawnego komunikatu HTTP; przetworzenie zależy od stanu konta i preconditions przyszłego testu."
      },
      "detection_layer": "schema_and_fixture_semantics"
    },
    {
      "id": "decimal-number",
      "purpose": "Odrzucenie: type",
      "path": "invalid/decimal-number.json",
      "schema": "../schemas/domain.schema.json#/$defs/Weight",
      "local": {
        "result": "invalid",
        "layer": "schema",
        "reason": "type"
      },
      "server": {
        "result": "not_executed",
        "stage": "E3",
        "expected_result": "Odrzucenie niepoprawnego wejścia przed mutacją; dokładny status zależy od kontenera żądania."
      },
      "detection_layer": "schema"
    },
    {
      "id": "decimal-zero-quantity",
      "purpose": "Odrzucenie: not",
      "path": "invalid/decimal-zero-quantity.json",
      "schema": "../schemas/domain.schema.json#/$defs/Meal",
      "local": {
        "result": "invalid",
        "layer": "schema",
        "reason": "not"
      },
      "server": {
        "result": "not_executed",
        "stage": "E3",
        "expected_result": "Odrzucenie niepoprawnego wejścia przed mutacją; dokładny status zależy od kontenera żądania."
      },
      "detection_layer": "schema"
    },
    {
      "id": "invalid-date",
      "purpose": "Odrzucenie: format",
      "path": "invalid/invalid-date.json",
      "schema": "../schemas/domain.schema.json#/$defs/Weight",
      "local": {
        "result": "invalid",
        "layer": "schema",
        "reason": "format"
      },
      "server": {
        "result": "not_executed",
        "stage": "E3",
        "expected_result": "Odrzucenie niepoprawnego wejścia przed mutacją; dokładny status zależy od kontenera żądania."
      },
      "detection_layer": "schema"
    },
    {
      "id": "invalid-uuid",
      "purpose": "Odrzucenie: format",
      "path": "invalid/invalid-uuid.json",
      "schema": "../schemas/domain.schema.json#/$defs/Meal",
      "local": {
        "result": "invalid",
        "layer": "schema",
        "reason": "format"
      },
      "server": {
        "result": "not_executed",
        "stage": "E3",
        "expected_result": "Odrzucenie niepoprawnego wejścia przed mutacją; dokładny status zależy od kontenera żądania."
      },
      "detection_layer": "schema"
    },
    {
      "id": "unknown-timezone",
      "purpose": "Odrzucenie: format",
      "path": "invalid/unknown-timezone.json",
      "schema": "../schemas/domain.schema.json#/$defs/Profile",
      "local": {
        "result": "invalid",
        "layer": "schema",
        "reason": "format"
      },
      "server": {
        "result": "not_executed",
        "stage": "E3",
        "expected_result": "Odrzucenie niepoprawnego wejścia przed mutacją; dokładny status zależy od kontenera żądania."
      },
      "detection_layer": "schema"
    },
    {
      "id": "missing-density",
      "purpose": "Odrzucenie: density_required",
      "path": "invalid/missing-density.json",
      "schema": "../schemas/domain.schema.json#/$defs/Meal",
      "local": {
        "result": "invalid",
        "layer": "semantic",
        "reason": "density_required"
      },
      "server": {
        "result": "not_executed",
        "stage": "E3",
        "expected_result": "Odrzucenie niepoprawnego wejścia przed mutacją; dokładny status zależy od kontenera żądania."
      },
      "detection_layer": "semantic"
    },
    {
      "id": "local-date-mismatch",
      "purpose": "Odrzucenie: local_date_mismatch",
      "path": "invalid/local-date-mismatch.json",
      "schema": "../schemas/domain.schema.json#/$defs/Meal",
      "local": {